{
  "version": "1.0.0",
  "meta": {
    "startUrl": "https://mall.example.com/search?q=手机",
    "title": "商品搜索",
    "recordedAt": "2026-07-04T10:00:00Z",
    "domain": "mall.example.com"
  },
  "events": [
    { "type": "navigate", "url": "https://mall.example.com/search?q=手机", "timestamp": 1 },
    { "type": "inputText", "index": 5, "text": "手机", "timestamp": 2 },
    { "type": "click", "index": 12, "timestamp": 3 },
    { "type": "scroll", "direction": "down", "amount": 1, "unit": "pages", "timestamp": 4 },
    { "type": "extract", "index": 20, "fieldName": "title", "mode": "text", "timestamp": 5 }
  ],
  "snapshots": [
    {
      "timestamp": 1,
      "url": "https://mall.example.com/search?q=手机",
      "selectorMap": {
        "5": { "index": 5, "tagName": "input", "selector": "#search-input", "boundingRect": { "x": 0, "y": 0, "width": 10, "height": 10 } },
        "12": { "index": 12, "tagName": "button", "selector": ".search-btn", "boundingRect": { "x": 0, "y": 0, "width": 10, "height": 10 } },
        "20": { "index": 20, "tagName": "h3", "selector": ".product-title", "boundingRect": { "x": 0, "y": 0, "width": 10, "height": 10 } }
      }
    }
  ]
}
